논문 번호,명사 추출 결과
1,논문 내용 셀룰로오스 기반 생 분해 고분자 복합재 물성 증가 관 연구 홍상준 이아 정 주상현 신영은 박태훈 초 록 기존 상용 플라스틱 환경 오염 대한 우려 대체 재료 로서 생 분해 고분자 대한 연구 주목 연구 생 분해 가소성 수지 폴리 젖산 유기 핵 제의 도입 물성 강 화 및 생 분해 나노 복합재 개발 목표 그 무기 핵 제의 대체재 친환경 소재 셀룰 로 오스 나노 섬유 채택 폴리 젖산 내 셀룰로오스 나노 섬유 분산 위해 동결 건조 방식 나 노화 섬유 형상 유지 축압 차 교반 진행 사출 성형 통해 이중 교반 물성 시험 용 시편 제작 보강 결정성 확인 위해 시차 주사 열량 법 사용 의 셀룰로오스 나노 섬유 보강 재 및 핵 제로 작용 냉 결정화 온도 약 가량 감소 결정화 정도 또한 증가 것 확인 연구 기존 생 분해 고분자 무기 핵제 유기 나노 소재 대체 함 생 분해 능 친환경 나노 복합재 개발 강화 물성 플라스틱 소재 개발 위 친환경 대안 시한 셀룰로오스 나노 섬유 폴리 젖산 나노 복합재 생 분해 고분자 핵제 론 플라스틱 소재 분해 단점 열 통해 성형 제조 및 가공 비용 장점 가지 거의 모든 산업 분야 활용 고 소모 플라스틱 처리 과정 중 분해 성질 매립 경우 토양 황폐 고 소각 경우 맹독 다이옥신 검 대기 오 실 염 발생 수 단점 해결 위해 자연 상 태 년 사이 분해 물 분해 재료 수 생 분해 플라스틱 대한 필요성 지속 의 로 강조 그 중 범용 플라스틱 대체 수지 사용 수지 의 녹는점 가지 위 생 분해 플라스틱 대한 연구 더 진행 의 밀도 소재 제작 현재 우리 사용 양 범용 위 소재 플라스틱 생 분해 고분자 대체 자연계 물질 순 의 제품 구매 사용 환 사슬 포함 수 환경보전 도움 것 시편 제작 생 분해 플라스틱 중 제조 위해 고형 의 분산 액 의 경우 대표 생 분해 가소성 폴리에스터 타 생 준비 이후 고압 균질 기 분해 플라스틱 열 생 분해 가지 를 기반 나노 또한 생체 내 물질 가수분해 때 과정 통해 수계 분산 에어로겔 제 문 일회용품 사용 뿐 생체 의료 고분자 작 위해 동결 건조기 사용 원료 의 경우 옥수수 전분 카 를 사용 건조 에어로겔 사바 뿌리 사탕 수로 수 때문 석유 라스 대한 친환경 대안 수 의 경우 장비 사용 분쇄 의 진공 상태 전분 포도당 발효 수 시간 동안 건조 팰릿 를 교 반한 다음 것 를 이용 축합 반응 통해 의 축압 를 생산 수 또한 를 통해 압출 과정 진행 압출 관능기 덕분 분해 가속 또한 분자량 결 조건 정리 정화 및 조성 기계 적 특성 제어 때문 목적 제품 생산 원료 로서 사 용 일회용품 재료 사용 사출 성 형 이후 다른 플라스틱 성형 품 결정화 이로 강도 및 충격 성과 기계 특성 다소 저하 성능 따라서 연구 문 언급 의 단점 극복 친수성 기반 를 보강 재 및 핵 제로 활용 성형 품 결정화 증가 및 기계 특성 향상 목적 연구 진행 친수성 화학 인 표면 첨가 축압 및 사출 성형 통해 소수성 분산 나노 복합재 완성 최적 압출 및 사출 조건 통해 제조 나노 복합재 먼저 내부 분산 의 관찰 통해 핵제 역할 가능 성 판단 의 첨가 영향 물성 강화 결과 수치화 결정화 및 기계 특성 분석 진 행 이후 압출된 나노 복합재 특성 분석 위해 의 사출 기 로 사출 성형 사출 조건 가제 로서 함량 로 고정 첨가 시편 경우 조건 실험 진행 위해 팰릿 첨가제 이축압출 기 압출 과정 회 진행 후 사출 진행 이미지 관찰 은 섬유 형상 종 횡비 내부 핵제 역할 이 실험 과정 나노 복합재 기계 강도 증가 수 실험 경우 시차 열량 또한 를 로 방식 섬유 형상 보 를 사용 의 속도 비활 존 수지 내 분산성 향상 결정 기체 분위기 진행 진 화도 증가 영향 것 관찰 행 또한 이력 효과 위해 진행 측정 관찰 주사 전자현미경 분석 압출 사출 성형 통해 제작 시편 를 사용 시편 경우 액체질소 닐링 진행 기반 제품 경 사용 냉각 다음 최대한 단면 형상 열처리 신 통해 결정화 증가 판매 관찰 때문 이 조건 시험 위해 수 측정 경우 유변 물성 측정기 행 어닐링 공정은 성형 이후 표면 존재 를 사용 가해진 열량 차이 결 잔류 응력 제거 수 성형 품 균열 후 수축 과 오차 시편 주변 온도 가열 시간 이 더 이상 발생 때문 제품 본연 물성 또한 사각형 모양 가로 세로 분석 어닐링 시간 동안 진행 인 시편 사용 장비 나노 복합재 첨가 의 유 측정 적기 분석 기 무 결정성 차이 관찰 위해 를 사용 시편 크기 설정 분석 샘플 준비 조건 의 결과 보아 첫 두 승 측정 폴리머 사이 결정성 차이 음 확인 수 두번째 냉 결정화 온도 영역 결 과 차이 것 의 경우 온도 냉 결정화 온 시편 형상 도 것 확인 수 압출 사출 성형 과정 통해 제조 시편 경우 냉 결정화 온도 감소 보강 재 이자 핵제 역할 의 첨가 유무 상이 색상 관찰 작용 함 증명 의 해당 의 팰릿 시편 경우 특성 보이지 폭 넓이 것 보아 냉 결정화 온도 만 첨가 시편 경우 성형 약 온도 시작 결정화 후 변화 색상 의 사출 정도 더 것 확인 수 의 변화 물의 색상 변화 첨가 의 핵제 역할 결정 화도 가소제 기능 것 추 증가 특성 내부 분산 론 수 이 결과 보아 핵 제로 핵제 역할 작용 함 알 수 의 작용 수지 내부 결정 생 것 알 수 경향 더욱 확대 이미지 크게 순수 인 비교 표면 섬유 상이 보이지 반면 를 첨가 의 경 우 섬유 일부 군집 수지 섬유 형 태 분산 것 볼 수 군집 입자 크기 기존 무기물 핵 제의 크기 범위 속 음 확인 측정 첨가 수지 유변 물성 특성 파악 위해 장비 통해 점도 측정 어간 복합재 경우 점도 것 확인 수 첨가 나노 필러 생 증점 효과 의 네트워크 구조 수지 결과 의 첨가 로 율 영역 의 점도 상 승률 로 약 상승 전 율 영역 은 로 약 만 상 승 가해진 응력 수 냉 결정화 이후 용융 를 확인 네트워크 구조 또한 때문 두 가지 결정 구조 형성 것 확인 수 초기 형태 선형 보강 재인 수지 내 네트워크 구조 형성 것 예측 주사 전자현미경 관찰 제작 시편 액체 질소 이용 절단 다음 절단 측정 면 주사 전자현미경 코리아 대한민국 의 기계 특성 영향 그 로 관찰 시편 위치 차이 리 의 결과 확인 결정화 효과 연관 애기 위해 두께 인 직사각형 모양 사출 물의 가운데 확인 위해 측정 진행 영역 후 관찰 것 의 온도 가파른 감소 확인 처럼 첨가 첨가제 수지 내 분 다만 온도 기준 초기 산 섬유 것 볼 수 이 비 비율 확인 이 소량 나노 필러 소재 첨가 온도 초기 대비 유지됨 온 가장 시점 결과 복합재 유지됨 확인 수 의 의 차 미분 그래프 확인 를 더 온도 수 부분 구간 연관 검증 수 의 의 사이 도 를 로 용융점 과 이 경쟁 구간 임 배 정도 값 의 첨가 부근 유 및 핵제 역할 통해 의 회복 능함 확인 수 결과 측정 의 적 안정 확인 위 분석 진행 승온 속도 분위기 측정 일반 유기 나노 소재 첨가 로 내열성 부분 변화 확인 의 결과 를 의 연소 시점 확인 복합재 내의 함량 중량 감 소가 의 열분해 가장 진행 온도 이 부분 변화 의 첨가 의 적 구성 감소 것 판단 수 결 론 연구 를 복합재 보강 재 및 핵제 로서 사용 의 나노 형상 반영 위 결 건조 통해 를 수 의 직경 유지 형상 혼합 나노 복합재 개발 처리 임 불구 소수성 수 내부 이축압출기 통해 분산 경우 결정성 증 수 음 확인 결과 통해 결정성 정 결과 의 경우 비 해 가량 냉 결정화 온도 것 확인 수 또한 냉 결정화 정도 또한 것 확인 수 기기 통해 형상 확인 결과 수지 내 분산 장비 통한 점도 관찰 결과 경우 매질 내 분산 점도 증가 것 확인 수 분석 결과 통 결과 연관 여 냉 결정화 진행 및 변화 경향 것 확인 결과 바탕 보아 기존 사용 무기 핵제 대체 친환경 생 분해 핵제 소재 작용 수 이 경우 소재 를 활용 수 것 기대 후 기 이 연구 년도 산업 통상 자원부 및 산업 기술 평가 관 리 구비 지원 연구 임
